{
  "ver_version": "1.0",
  "cpnp_version": "1.0",
  "record_id": "c43b51d5-91ad-589d-8aa3-c990ed34f2f4",
  "created_at": "2026-08-22T09:14:20Z",
  "generator": {
    "name": "ver-conformance-corpus",
    "version": "1.0.1"
  },
  "conformance_level": "L0",
  "identity": {
    "content_hash": {
      "alg": "sha-256",
      "value": "45656e3ec534f0e6993853cbe1c9645ce535741ddbb1a1fc69c8673c303a685b"
    },
    "pixel_hash": {
      "alg": "sha-256",
      "value": "c87ca9f2ee178aa90e590fa07f095e39dbc2165f4a6fbeeb0cd8028044fbc5b9",
      "width": 4032,
      "height": 3024
    },
    "perceptual": [
      {
        "alg": "pdq/1.0",
        "value": "0d9fcc58abcbea94dc55669723d8d8f13bb6c0c121b9aea65901f02293f69773"
      },
      {
        "alg": "phash-dct/64",
        "value": "1f4a0b21cc1277c7"
      }
    ]
  },
  "image": {
    "format": "jpeg",
    "width": 4032,
    "height": 3024,
    "animated": false,
    "alpha_present": false,
    "hdr_present": false,
    "source_bytes_ref": {
      "uri": "https://assets.example.org/blobs/boardwalk-sunset.jpg",
      "sha256": "45656e3ec534f0e6993853cbe1c9645ce535741ddbb1a1fc69c8673c303a685b",
      "byte_length": 2841377
    }
  },
  "spaces": [
    {
      "space_id": "org.verstandard.space.fixture-visual-16/1.0",
      "kind": "visual",
      "model": {
        "family": "fixture",
        "architecture": "toy-cnn-16d",
        "checkpoint": "conformance-corpus-16d",
        "weights_sha256": "ec5f51f8f4ffb02d461617f759109eb026eaa4bf391ccd40a2f3d2c7e5e6c432"
      },
      "dim": 16,
      "dtype": "fp32",
      "normalization": "l2",
      "metric": "cosine",
      "preprocessing": {
        "resize": "shortest_side_64",
        "interpolation": "bilinear",
        "antialias": true,
        "crop": "center_64",
        "mean": [
          0.5,
          0.5,
          0.5
        ],
        "std": [
          0.5,
          0.5,
          0.5
        ],
        "channel_order": "rgb"
      },
      "reference": {
        "set_uri": "https://verstandard.org/refsets/fixture-visual-16-1.0",
        "tolerance_cosine": 0.999
      }
    }
  ],
  "embeddings": [
    {
      "role": "canonical_visual",
      "space_id": "org.verstandard.space.fixture-visual-16/1.0",
      "dim": 16,
      "dtype": "fp32",
      "produced_at": "2026-08-22T09:14:10Z",
      "producer": "ver-producer/1.0.3 (onnxruntime-gpu 1.22, fp32)",
      "vector": [
        0.38653854,
        -0.31674683,
        -0.14495195,
        -0.31137824,
        0.07516027,
        -0.31137824,
        -0.08052886,
        -0.01610577,
        -0.12884617,
        0.26306096,
        0.37580135,
        0.03758014,
        -0.04294873,
        -0.25769234,
        0.13421477,
        -0.45633021
      ]
    }
  ]
}
